{
  "agente_id": "082-tlachixqui",
  "public_key_hex": "0000000000000000000000000000000000000000000000000000000000000000",
  "algoritmo": "Ed25519",
  "rol": "auditor",
  "valido_desde": "2026-09-30T00:00:00Z",
  "valido_hasta": "2027-09-30T00:00:00Z",
  "firma_fundador": "00000000000000000000000000000000000000000000000000000000000000000000000000000000000000000000000000000000000000000000000000000000"
}
